### BTest baseline data generated by btest-diff. Do not edit. Use "btest -U/-u" to update. Requires BTest >= 0.63.
    1   0.000000 192.168.1.100 → 192.168.1.200 TCP 40 45678 → 80 [SYN] Seq=0 Win=8192 Len=0
    2   0.000094 192.168.1.200 → 192.168.1.100 TCP 40 80 → 45678 [SYN, ACK] Seq=0 Ack=1 Win=8192 Len=0
    3   0.000145 192.168.1.100 → 192.168.1.200 TCP 40 45678 → 80 [ACK] Seq=1 Ack=1 Win=8192 Len=0
    4   0.000192 192.168.1.100 → 192.168.1.200 <service> 85
    5   0.000287 192.168.1.100 → 192.168.1.200 <service> 187
    6   0.000375 192.168.1.100 → 192.168.1.200 spicy_HTTP 99 Request: [$request=[$method=b"GET", $uri=b"/index.html", $version=[$number=b"1.1"]], $message=[$headers=[[$name=b"Host", $content=b"example.com"], [$name=b"User-Agent", $content=b"Mozilla/5.0 (Windows NT 10.0; Win64; x64) AppleWebKit/537.36"], [$name=b"Accept", $content=b"text/html,application/xhtml+xml,application/xml;q=0.9,*/*;q=0.8"], [$name=b"Accept-Language", $content=b"en-US,en;q=0.5"], [$name=b"Connection", $content=b"keep-alive"]], $end_of_hdr=b"\x0d\x0a", $body=(not set), $has_body=False, $is_request=True, $content_encoding=(not set), $use_content_length=True, $body_len=(not set), $content_length=(not set), $content_type=(b"TEXT", b"PLAIN"), $content_type_parameter=(not set), $delivery_mode=DeliveryMode::EndOfData, $multipart_boundary=(not set), $transfer_encoding=(not set)]]
    7   0.000463 192.168.1.200 → 192.168.1.100 TCP 40 80 → 45678 [ACK] Seq=1 Ack=252 Win=8192 Len=0
    8   0.000511 192.168.1.200 → 192.168.1.100 <service> 117
    9   0.000599 192.168.1.200 → 192.168.1.100 <service> 127
   10   0.000689 192.168.1.200 → 192.168.1.100 spicy_HTTP 166 Reply: [$reply=[$version=[$number=b"1.1"], $status=200, $reason=b"OK"], $message=[$headers=[[$name=b"Date", $content=b"Mon, 01 Apr 2024 12:00:00 GMT"], [$name=b"Server", $content=b"Apache/2.4.41"], [$name=b"Content-Type", $content=b"text/html; charset=UTF-8"], [$name=b"Content-Length", $content=b"126"], [$name=b"Connection", $content=b"keep-alive"]], $end_of_hdr=b"\x0d\x0a", $body=[$data=<sink>], $has_body=True, $is_request=False, $content_encoding=(not set), $use_content_length=True, $body_len=126, $content_length=126, $content_type=(b"TEXT", b"HTML"), $content_type_parameter=b"charset=UTF-8", $delivery_mode=DeliveryMode::Length, $multipart_boundary=(not set), $transfer_encoding=(not set)]]
   11   0.000775 192.168.1.100 → 192.168.1.200 TCP 40 45678 → 80 [ACK] Seq=252 Ack=291 Win=8192 Len=0
   12   0.000821 192.168.1.100 → 192.168.1.200 <service> 85
   13   0.000906 192.168.1.100 → 192.168.1.200 <service> 187
   14   0.001028 192.168.1.100 → 192.168.1.200 spicy_HTTP 99 Request: [$request=[$method=b"GET", $uri=b"/about.html", $version=[$number=b"1.1"]], $message=[$headers=[[$name=b"Host", $content=b"example.com"], [$name=b"User-Agent", $content=b"Mozilla/5.0 (Windows NT 10.0; Win64; x64) AppleWebKit/537.36"], [$name=b"Accept", $content=b"text/html,application/xhtml+xml,application/xml;q=0.9,*/*;q=0.8"], [$name=b"Accept-Language", $content=b"en-US,en;q=0.5"], [$name=b"Connection", $content=b"keep-alive"]], $end_of_hdr=b"\x0d\x0a", $body=(not set), $has_body=False, $is_request=True, $content_encoding=(not set), $use_content_length=True, $body_len=(not set), $content_length=(not set), $content_type=(b"TEXT", b"PLAIN"), $content_type_parameter=(not set), $delivery_mode=DeliveryMode::EndOfData, $multipart_boundary=(not set), $transfer_encoding=(not set)]]
   15   0.001114 192.168.1.200 → 192.168.1.100 TCP 40 80 → 45678 [ACK] Seq=291 Ack=503 Win=8192 Len=0
   16   0.001159 192.168.1.200 → 192.168.1.100 <service> 117
   17   0.001245 192.168.1.200 → 192.168.1.100 <service> 127
   18   0.001331 192.168.1.200 → 192.168.1.100 spicy_HTTP 160 Reply: [$reply=[$version=[$number=b"1.1"], $status=200, $reason=b"OK"], $message=[$headers=[[$name=b"Date", $content=b"Mon, 01 Apr 2024 12:00:05 GMT"], [$name=b"Server", $content=b"Apache/2.4.41"], [$name=b"Content-Type", $content=b"text/html; charset=UTF-8"], [$name=b"Content-Length", $content=b"120"], [$name=b"Connection", $content=b"keep-alive"]], $end_of_hdr=b"\x0d\x0a", $body=[$data=<sink>], $has_body=True, $is_request=False, $content_encoding=(not set), $use_content_length=True, $body_len=120, $content_length=120, $content_type=(b"TEXT", b"HTML"), $content_type_parameter=b"charset=UTF-8", $delivery_mode=DeliveryMode::Length, $multipart_boundary=(not set), $transfer_encoding=(not set)]]
   19   0.001415 192.168.1.100 → 192.168.1.200 TCP 40 45678 → 80 [ACK] Seq=503 Ack=575 Win=8192 Len=0
   20   0.001459 192.168.1.100 → 192.168.1.200 TCP 40 45678 → 80 [FIN, ACK] Seq=503 Ack=575 Win=8192 Len=0
   21   0.001507 192.168.1.200 → 192.168.1.100 TCP 40 80 → 45678 [FIN, ACK] Seq=575 Ack=504 Win=8192 Len=0
   22   0.001551 192.168.1.100 → 192.168.1.200 TCP 40 45678 → 80 [ACK] Seq=504 Ack=576 Win=8192 Len=0
Frame 1: 40 bytes on wire (320 bits), 40 bytes captured (320 bits)
Internet Protocol Version 4, Src: 192.168.1.100, Dst: 192.168.1.200
Transmission Control Protocol, Src Port: 45678, Dst Port: 80, Seq: 0, Len: 0

Frame 2: 40 bytes on wire (320 bits), 40 bytes captured (320 bits)
Internet Protocol Version 4, Src: 192.168.1.200, Dst: 192.168.1.100
Transmission Control Protocol, Src Port: 80, Dst Port: 45678, Seq: 0, Ack: 1, Len: 0

Frame 3: 40 bytes on wire (320 bits), 40 bytes captured (320 bits)
Internet Protocol Version 4, Src: 192.168.1.100, Dst: 192.168.1.200
Transmission Control Protocol, Src Port: 45678, Dst Port: 80, Seq: 1, Ack: 1, Len: 0

Frame 4: 85 bytes on wire (680 bits), 85 bytes captured (680 bits)
Internet Protocol Version 4, Src: 192.168.1.100, Dst: 192.168.1.200
Transmission Control Protocol, Src Port: 45678, Dst Port: 80, Seq: 1, Ack: 1, Len: 45

Frame 5: 187 bytes on wire (1496 bits), 187 bytes captured (1496 bits)
Internet Protocol Version 4, Src: 192.168.1.100, Dst: 192.168.1.200
Transmission Control Protocol, Src Port: 45678, Dst Port: 80, Seq: 46, Ack: 1, Len: 147

Frame 6: 99 bytes on wire (792 bits), 99 bytes captured (792 bits)
Internet Protocol Version 4, Src: 192.168.1.100, Dst: 192.168.1.200
Transmission Control Protocol, Src Port: 45678, Dst Port: 80, Seq: 193, Ack: 1, Len: 59
[3 Reassembled TCP Segments (251 bytes): #4(45), #5(147), #6(59)]
Hypertext Transfer Protocol [Spicy], Request: [$request=[$method=b"GET", $uri=b"/index.html", $version=[$number=b"1.1"]], $message=[$headers=[[$na …
    request: [$method=b"GET", $uri=b"/index.html", $version=[$number=b"1.1"]]
        method: GET
        uri: /index.html
        version: [$number=b"1.1"]
            number: 1.1
    message: [$headers=[[$name=b"Host", $content=b"example.com"], [$name=b"User-Agent", $content=b"Mozilla/5.0 (W …
        […] headers: [[$name=b"Host", $content=b"example.com"], [$name=b"User-Agent", $content=b"Mozilla/5.0 (Windows NT 10.0; Win64; x64) AppleWebKit/537.36"], [$name=b"Accept", $content=b"text/html,application/
            [$name=b"Host", $content=b"example.com"]
                name: Host
                content: example.com
            [$name=b"User-Agent", $content=b"Mozilla/5.0 (Windows NT 10.0; Win64; x64) AppleWebKit/537.36"]
                name: User-Agent
                content: Mozilla/5.0 (Windows NT 10.0; Win64; x64) AppleWebKit/537.36
            [$name=b"Accept", $content=b"text/html,application/xhtml+xml,application/xml;q=0.9,*/*;q=0.8"]
                name: Accept
                content: text/html,application/xhtml+xml,application/xml;q=0.9,*/*;q=0.8
            [$name=b"Accept-Language", $content=b"en-US,en;q=0.5"]
                name: Accept-Language
                content: en-US,en;q=0.5
            [$name=b"Connection", $content=b"keep-alive"]
                name: Connection
                content: keep-alive
        end_of_hdr: \r\n
        has_body: False
        is_request: True
        use_content_length: True
        content_type: (b"TEXT", b"PLAIN")
            TEXT
            PLAIN
        delivery_mode: EndOfData (0x00)

Frame 7: 40 bytes on wire (320 bits), 40 bytes captured (320 bits)
Internet Protocol Version 4, Src: 192.168.1.200, Dst: 192.168.1.100
Transmission Control Protocol, Src Port: 80, Dst Port: 45678, Seq: 1, Ack: 252, Len: 0

Frame 8: 117 bytes on wire (936 bits), 117 bytes captured (936 bits)
Internet Protocol Version 4, Src: 192.168.1.200, Dst: 192.168.1.100
Transmission Control Protocol, Src Port: 80, Dst Port: 45678, Seq: 1, Ack: 252, Len: 77

Frame 9: 127 bytes on wire (1016 bits), 127 bytes captured (1016 bits)
Internet Protocol Version 4, Src: 192.168.1.200, Dst: 192.168.1.100
Transmission Control Protocol, Src Port: 80, Dst Port: 45678, Seq: 78, Ack: 252, Len: 87

Frame 10: 166 bytes on wire (1328 bits), 166 bytes captured (1328 bits)
Internet Protocol Version 4, Src: 192.168.1.200, Dst: 192.168.1.100
Transmission Control Protocol, Src Port: 80, Dst Port: 45678, Seq: 165, Ack: 252, Len: 126
[3 Reassembled TCP Segments (290 bytes): #8(77), #9(87), #10(126)]
Hypertext Transfer Protocol [Spicy], Reply: [$reply=[$version=[$number=b"1.1"], $status=200, $reason=b"OK"], $message=[$headers=[[$name=b"Date", …
    reply: [$version=[$number=b"1.1"], $status=200, $reason=b"OK"]
        version: [$number=b"1.1"]
            number: 1.1
        status: 200
        reason: OK
    message: [$headers=[[$name=b"Date", $content=b"Mon, 01 Apr 2024 12:00:00 GMT"], [$name=b"Server", $content=b" …
        […] headers: [[$name=b"Date", $content=b"Mon, 01 Apr 2024 12:00:00 GMT"], [$name=b"Server", $content=b"Apache/2.4.41"], [$name=b"Content-Type", $content=b"text/html; charset=UTF-8"], [$name=b"Content-Leng
            [$name=b"Date", $content=b"Mon, 01 Apr 2024 12:00:00 GMT"]
                name: Date
                content: Mon, 01 Apr 2024 12:00:00 GMT
            [$name=b"Server", $content=b"Apache/2.4.41"]
                name: Server
                content: Apache/2.4.41
            [$name=b"Content-Type", $content=b"text/html; charset=UTF-8"]
                name: Content-Type
                content: text/html; charset=UTF-8
            [$name=b"Content-Length", $content=b"126"]
                name: Content-Length
                content: 126
            [$name=b"Connection", $content=b"keep-alive"]
                name: Connection
                content: keep-alive
        end_of_hdr: \r\n
        body: [$data=<sink>]
        has_body: True
        is_request: False
        use_content_length: True
        body_len: 126
        content_length: 126
        content_type: (b"TEXT", b"HTML")
            TEXT
            HTML
        content_type_parameter: charset=UTF-8
        delivery_mode: Length (0x01)

Frame 11: 40 bytes on wire (320 bits), 40 bytes captured (320 bits)
Internet Protocol Version 4, Src: 192.168.1.100, Dst: 192.168.1.200
Transmission Control Protocol, Src Port: 45678, Dst Port: 80, Seq: 252, Ack: 291, Len: 0

Frame 12: 85 bytes on wire (680 bits), 85 bytes captured (680 bits)
Internet Protocol Version 4, Src: 192.168.1.100, Dst: 192.168.1.200
Transmission Control Protocol, Src Port: 45678, Dst Port: 80, Seq: 252, Ack: 291, Len: 45

Frame 13: 187 bytes on wire (1496 bits), 187 bytes captured (1496 bits)
Internet Protocol Version 4, Src: 192.168.1.100, Dst: 192.168.1.200
Transmission Control Protocol, Src Port: 45678, Dst Port: 80, Seq: 297, Ack: 291, Len: 147

Frame 14: 99 bytes on wire (792 bits), 99 bytes captured (792 bits)
Internet Protocol Version 4, Src: 192.168.1.100, Dst: 192.168.1.200
Transmission Control Protocol, Src Port: 45678, Dst Port: 80, Seq: 444, Ack: 291, Len: 59
[3 Reassembled TCP Segments (251 bytes): #12(45), #13(147), #14(59)]
Hypertext Transfer Protocol [Spicy], Request: [$request=[$method=b"GET", $uri=b"/about.html", $version=[$number=b"1.1"]], $message=[$headers=[[$na …
    request: [$method=b"GET", $uri=b"/about.html", $version=[$number=b"1.1"]]
        method: GET
        uri: /about.html
        version: [$number=b"1.1"]
            number: 1.1
    message: [$headers=[[$name=b"Host", $content=b"example.com"], [$name=b"User-Agent", $content=b"Mozilla/5.0 (W …
        […] headers: [[$name=b"Host", $content=b"example.com"], [$name=b"User-Agent", $content=b"Mozilla/5.0 (Windows NT 10.0; Win64; x64) AppleWebKit/537.36"], [$name=b"Accept", $content=b"text/html,application/
            [$name=b"Host", $content=b"example.com"]
                name: Host
                content: example.com
            [$name=b"User-Agent", $content=b"Mozilla/5.0 (Windows NT 10.0; Win64; x64) AppleWebKit/537.36"]
                name: User-Agent
                content: Mozilla/5.0 (Windows NT 10.0; Win64; x64) AppleWebKit/537.36
            [$name=b"Accept", $content=b"text/html,application/xhtml+xml,application/xml;q=0.9,*/*;q=0.8"]
                name: Accept
                content: text/html,application/xhtml+xml,application/xml;q=0.9,*/*;q=0.8
            [$name=b"Accept-Language", $content=b"en-US,en;q=0.5"]
                name: Accept-Language
                content: en-US,en;q=0.5
            [$name=b"Connection", $content=b"keep-alive"]
                name: Connection
                content: keep-alive
        end_of_hdr: \r\n
        has_body: False
        is_request: True
        use_content_length: True
        content_type: (b"TEXT", b"PLAIN")
            TEXT
            PLAIN
        delivery_mode: EndOfData (0x00)

Frame 15: 40 bytes on wire (320 bits), 40 bytes captured (320 bits)
Internet Protocol Version 4, Src: 192.168.1.200, Dst: 192.168.1.100
Transmission Control Protocol, Src Port: 80, Dst Port: 45678, Seq: 291, Ack: 503, Len: 0

Frame 16: 117 bytes on wire (936 bits), 117 bytes captured (936 bits)
Internet Protocol Version 4, Src: 192.168.1.200, Dst: 192.168.1.100
Transmission Control Protocol, Src Port: 80, Dst Port: 45678, Seq: 291, Ack: 503, Len: 77

Frame 17: 127 bytes on wire (1016 bits), 127 bytes captured (1016 bits)
Internet Protocol Version 4, Src: 192.168.1.200, Dst: 192.168.1.100
Transmission Control Protocol, Src Port: 80, Dst Port: 45678, Seq: 368, Ack: 503, Len: 87

Frame 18: 160 bytes on wire (1280 bits), 160 bytes captured (1280 bits)
Internet Protocol Version 4, Src: 192.168.1.200, Dst: 192.168.1.100
Transmission Control Protocol, Src Port: 80, Dst Port: 45678, Seq: 455, Ack: 503, Len: 120
[3 Reassembled TCP Segments (284 bytes): #16(77), #17(87), #18(120)]
Hypertext Transfer Protocol [Spicy], Reply: [$reply=[$version=[$number=b"1.1"], $status=200, $reason=b"OK"], $message=[$headers=[[$name=b"Date", …
    reply: [$version=[$number=b"1.1"], $status=200, $reason=b"OK"]
        version: [$number=b"1.1"]
            number: 1.1
        status: 200
        reason: OK
    message: [$headers=[[$name=b"Date", $content=b"Mon, 01 Apr 2024 12:00:05 GMT"], [$name=b"Server", $content=b" …
        […] headers: [[$name=b"Date", $content=b"Mon, 01 Apr 2024 12:00:05 GMT"], [$name=b"Server", $content=b"Apache/2.4.41"], [$name=b"Content-Type", $content=b"text/html; charset=UTF-8"], [$name=b"Content-Leng
            [$name=b"Date", $content=b"Mon, 01 Apr 2024 12:00:05 GMT"]
                name: Date
                content: Mon, 01 Apr 2024 12:00:05 GMT
            [$name=b"Server", $content=b"Apache/2.4.41"]
                name: Server
                content: Apache/2.4.41
            [$name=b"Content-Type", $content=b"text/html; charset=UTF-8"]
                name: Content-Type
                content: text/html; charset=UTF-8
            [$name=b"Content-Length", $content=b"120"]
                name: Content-Length
                content: 120
            [$name=b"Connection", $content=b"keep-alive"]
                name: Connection
                content: keep-alive
        end_of_hdr: \r\n
        body: [$data=<sink>]
        has_body: True
        is_request: False
        use_content_length: True
        body_len: 120
        content_length: 120
        content_type: (b"TEXT", b"HTML")
            TEXT
            HTML
        content_type_parameter: charset=UTF-8
        delivery_mode: Length (0x01)

Frame 19: 40 bytes on wire (320 bits), 40 bytes captured (320 bits)
Internet Protocol Version 4, Src: 192.168.1.100, Dst: 192.168.1.200
Transmission Control Protocol, Src Port: 45678, Dst Port: 80, Seq: 503, Ack: 575, Len: 0

Frame 20: 40 bytes on wire (320 bits), 40 bytes captured (320 bits)
Internet Protocol Version 4, Src: 192.168.1.100, Dst: 192.168.1.200
Transmission Control Protocol, Src Port: 45678, Dst Port: 80, Seq: 503, Ack: 575, Len: 0

Frame 21: 40 bytes on wire (320 bits), 40 bytes captured (320 bits)
Internet Protocol Version 4, Src: 192.168.1.200, Dst: 192.168.1.100
Transmission Control Protocol, Src Port: 80, Dst Port: 45678, Seq: 575, Ack: 504, Len: 0

Frame 22: 40 bytes on wire (320 bits), 40 bytes captured (320 bits)
Internet Protocol Version 4, Src: 192.168.1.100, Dst: 192.168.1.200
Transmission Control Protocol, Src Port: 45678, Dst Port: 80, Seq: 504, Ack: 576, Len: 0

